Key	English	Japanese	French	Spanish	German	Italian	Korean	ChineseSimplified	ChineseTraditional	BrazilianPortuguese
news_main_text_alolan	Great news, Trainers! The trading and friend features have started rolling out. These features will begin appearing gradually based on Trainer level, so keep your eye on our social media channels for updates on when they will become available to you. The Alolan forms of even more Pokémon originally discovered in the Kanto region will also start appearing in the wild, showing up in Raid Battles, and hatching from Eggs found in Gifts! Celebrate the spirit of Alola with friends—and get ready for some exciting changes. Stay safe, and happy exploring!	「フレンド機能」と「ポケモン交換」が新たに追加されます！これらの新機能は、トレーナーレベルに応じて段階的に使えるようになりますので、ソーシャルメディアでの最新情報にご注目ください。新機能に加え、アローラのすがたの新たなポケモンたちが、レイドバトルやギフトで手に入れたタマゴから続々登場予定です！個性豊かなポケモンたちとの冒険や、エキサイティングな新機能をお楽しみに！ \nPokémon GOで遊ぶ時は、周囲に注意しながらお楽しみください。 \n \n—Pokémon GO 開発チームより 	Bonnes nouvelles, Dresseurs ! Les fonctions d’échanges et d’amis vont être graduellement disponibles en jeu. Ces fonctions apparaîtront suivant votre niveau de Dresseur, alors restez à l’écoute sur nos réseaux sociaux pour savoir quand elles seront disponibles pour vous. Les formes d’Alola d’autres Pokémon découverts dans la région de Kanto vont commencer à apparaître dans la nature ou dans les Combats de Raids, ainsi que dans des Œufs trouvés dans des Cadeaux, puis éclos. Célébrez l’esprit d’Alola avec vos amis, et soyez prêt pour les échanges ! Soyez prudent, et bonne exploration.	¡Buenas noticias! Las funciones de amistad y de intercambio han empezado a salir. Estas funciones irán apareciendo de forma gradual según el nivel de Entrenador, así que estate atento a los canales de redes sociales para ver actualizaciones sobre cuándo estarán disponibles para ti. También empezarán a aparecer las formas de Alola de aún más Pokémon originalmente descubiertos en la región de Kanto en estado salvaje, en incursiones y de Huevos que se encuentren en regalos. ¡Celebra el espíritu de Alola con amigos y prepárate para algunos cambios muy emocionantes! ¡Recuerda estar alerta a tus alrededores mientras disfrutas explorando!	Gute Neuigkeiten, Trainer! Die Freischaltung der Freundschafts- und Tauschfunktionen hat begonnen. Diese neuen Features werden basierend auf Trainerlevels nach und nach auftauchen, also halte die Augen in den sozialen Netzwerken offen, um zu erfahren, wann diese Updates für dich verfügbar sein werden. Des Weiteren erscheinen im Freien Alola-Formen von noch mehr Pokémon, die ursprünglich in der Kanto-Region entdeckt wurden. Sie lassen sich auch in Raid-Kämpfen blicken und schlüpfen aus Eiern, die durch Geschenke erhalten wurden! Feier den Geist von Alola mit deinen Freunden und sei bereit für ein paar aufregende Neuerungen. Allzeit sichere und schöne Entdeckungsreisen!	Ultime notizie! La funzione scambi e la funzione amici saranno rilasciate gradualmente. Diventeranno infatti disponibili in base al livello Allenatore, per cui tieni d’occhio i nostri canali social per non perderti gli aggiornamenti a riguardo. Anche sempre più Forme di Alola dei Pokémon selvatici originari della regione di Kanto stanno a mano a mano facendo capolino nei raid e nelle Uova trovate nei pacchi amicizia! Festeggia con gli amici alla maniera di Alola e preparati per una miriade di entusiasmanti novità! Ricorda di essere sempre prudente e buon divertimento!	「친구 기능」과 「포켓몬 교환」이 새롭게 추가됩니다! 이 새로운 기능은 트레이너 레벨에 따라 단계적으로 사용할 수 있으니 소셜미디어에서의 최신 정보를 확인해 주세요. 새로운 기능에 덧붙여 알로라의 모습의 새로운 포켓몬이 레이드배틀이나 선물로 손에 넣은 알에서 등장할 예정입니다! 다양한 개성을 가진 포켓몬과의 모험을 더 재미있는 새로운 기능으로 즐겨보세요! \n  \n—Pokémon GO 개발팀 		各位親愛的訓練家們： \n \n好消息！Pokémon GO新增朋友功能！朋友功能將依訓練家等級依序開放，請持續關注我們的社群網站，確認最新消息。此外，更多阿羅拉的樣子的寶可夢也將加入Pokémon GO，除了可以捉到野生的牠們，也可以在團體戰、甚至是「友情禮物」的蛋裡找到牠們喔！和來自阿羅拉的新朋友一起慶祝新功能的加入吧！ \n \n玩遊戲時請注意周遭環境，小心安全。 \n \n—Pokémon GO開發團隊敬上 	Temos notícias geniais! As funções de amizade e troca já chegaram. Estas funções aparecerão gradualmente baseadas no nível do Treinador, então fique de olho nas mídias sociais para notícias sobre quando elas estarão disponíveis para você. As formas de Alola de um número ainda maior de Pokémon selvagens originários da região de Kanto começarão a aparecer nas Batalhas de Reide e em Ovos encontrados em presentes! Comemore o espírito de Alola com seus amigos e se prepare para mudanças empolgantes. Tome cuidado e divirta-se explorando o mundo!
news_header_regice	The Legendary Pokémon Regice Is Ready for Bone-Chilling Raid Battles!	伝説のポケモン「レジアイス」が、伝説レイドバトルに登場！	Regice, le Pokémon légendaire, s'apprête à des Combats de Raids à glacer le sang.	¡El Pokémon legendario Regice está listo para incursiones de las que te dejan helado!	Das Legendäre Pokémon Regice ist bereit für eisige Raid-Kämpfe!	Il Pokémon leggendario Regice è pronto per lotte da brivido!	전설의 포켓몬 「레지아이스」가 전설레이드에 등장!		傳說的寶可夢「雷吉艾斯」降臨團體戰！	O Pokémon Lendário Regice está pronto para Batalhas de Reide de dar calafrios!
news_subheader_regice	The Legendary Pokémon Regice Is Ready for Bone-Chilling Raid Battles!	伝説のポケモン「レジアイス」が、伝説レイドバトルに登場！	Regice, le Pokémon légendaire, s'apprête à des Combats de Raids à glacer le sang.	¡El Pokémon legendario Regice está listo para incursiones de las que te dejan helado!	Das Legendäre Pokémon Regice ist bereit für eisige Raid-Kämpfe!	Il Pokémon leggendario Regice è pronto per lotte da brivido!	전설의 포켓몬 「레지아이스」가 전설레이드에 등장!		傳說的寶可夢「雷吉艾斯」降臨團體戰！	O Pokémon Lendário Regice está pronto para Batalhas de Reide de dar calafrios!
news_main_text_regice	Pokémon’s legendary year continues with three Legendary Pokémon originally discovered in the Hoenn region harnessing their power to take over Raid Battles in Pokémon GO, starting with Regice on June 21! This Ice-type Legendary Pokémon has a strong defense, but is weak to Fire-, Fighting-, Rock-, and Steel-type attacks. The presence of the Iceberg Pokémon kicks off a summer of earth-shattering events, as Regirock and Registeel will also roar into Gyms worldwide! Don’t miss this chance to catch this Legendary Pokémon before it returns to another long slumber! Stay safe, and happy exploring!	ホウエン地方で見つかった3匹の伝説のポケモンが長い眠りから目覚め、ついに Pokémon GO に登場します。まずは日本時間6月22日（金）から7月19日（木）までの間、ひょうざんポケモンの「レジアイス」が、世界中の伝説レイドバトルでその姿を現します！「レジアイス」はマグマでも溶けない氷の体を持つといわれている、こおりタイプの伝説のポケモンです。この夏以降にかけて、「レジアイス」に続き「レジロック」「レジスチル」も続々と登場するので、是非フレンドと協力し、この守りのかたい伝説のポケモンたちに挑戦しましょう。また長い眠りについてしまう前にレジアイスを倒し、ゲットしましょう！Pokémon GO を遊ぶ際は、周囲に注意しながらお楽しみください！ \n \n—Pokémon GO 開発チームより 	L’année légendaire de Pokémon continue avec trois Pokémon légendaires découverts dans la région de Hoenn qui mobilisent leur puissance pour les Combats de Raids dans Pokémon GO, à commencer par Regice dès le 21 juin. Ce Pokémon légendaire de type Glace possède une très bonne défense mais présente une Faiblesse aux attaques de types Feu, Combat, Roche et Acier. La présence du Pokémon Iceberg annonce un été prometteur en évènements, car Regirock et Registeel rugiront également dans les Arènes du monde entier. Ne loupez pas ce Pokémon légendaire avant qu’il ne disparaisse pour longtemps. Soyez prudent, et bonne exploration.	Continúa el año legendario Pokémon con tres Pokémon legendarios, originalmente descubiertos en la región de Hoenn, que están preparados para desatar todo su poder en incursiones de Pokémon GO, ¡empezando con Regice a partir del 21 de junio! Regice es un Pokémon legendario de tipo Hielo débil ante ataques de tipo Fuego, Lucha, Roca y Acero. La presencia de esta potencia defensiva da inicio a un verano de eventos que hacen temblar la tierra, ¡ya que Regirock y Registeel también rugirán en Gimnasios de todo el mundo! ¡No te pierdas esta oportunidad de atrapar a este Pokémon legendario antes de que desaparezca por mucho tiempo! ¡Recuerda estar alerta a tus alrededores mientras disfrutas explorando!	Das legendäre Jahr von Pokémon setzt sich mit drei Legendären Pokémon, die zuerst in der Hoenn-Region entdeckt wurden, fort. Diese Pokémon nutzen ihre Kräfte, um die Kontrolle über die Raid-Kämpfe in Pokémon GO zu übernehmen. Als Erstes betritt Regice am 21. Juni auf die Bühne! Regice ist ein Legendäres Eis-Pokémon, das schwach gegen Attacken vom Typ Feuer, Kampf, Gestein und Stahl ist. Der Auftritt dieses defensiven Kraftpakets bringt einen Sommer mit weltbewegenden Veranstaltungen ins Rollen. Auch Regirock und Registeel lassen nicht lange auf sich warten, um in Arenen auf der ganzen Welt Unruhe zu stiften! Bevor sich das Legendäre Pokémon Regice wieder für längere Zeit verabschiedet, solltest du die Chance nutzen, es zu fangen! Allzeit sichere und schöne Entdeckungsreisen!	L’anno leggendario continua con tre Pokémon leggendari originariamente scoperti nella regione di Hoenn che si scateneranno nei raid di Pokémon GO. Il primo a raggelare l’ambiente sarà Regice il 21 giugno! Questo Pokémon leggendario di tipo Ghiaccio, anche se dotato di una solida difesa, è però debole agli attacchi di tipo Fuoco, Lotta, Roccia e Acciaio. La presenza del Pokémon Iceberg darà il via a una stagione estiva costellata di portenti della natura quali Regirock e Registeel che si succederanno nelle Palestre di tutto il mondo! Non perdere l’occasione di catturare questo Pokémon leggendario prima che ricada in altro lungo sonno! Ricorda di essere sempre prudente e buon divertimento!	호연지방에서 발견된 3마리의 전설의 포켓몬이 긴 잠에서 깨어나 드디어 Pokémon GO에 등장합니다. 먼저 한국 시각 6월 22일(금)부터 7월 19일(목)까지, 빙산포켓몬 「레지아이스」가 전 세계 전설레이드에 그 모습을 나타냅니다! 「레지아이스」는 마그마로도 녹지 않은 얼음의 몸을 가진다고 전해지는 얼음타입의 전설의 포켓몬입니다. 올여름에 「레지아이스」에 이어 「레지락」, 「레지스틸」도 계속해서 등장하니 친구와 협력하여 이 만만치 않은 전설의 포켓몬들에게 도전해 보세요. 또다시 긴 잠이 들기 전에 레지아이스를 쓰러뜨리고 잡아 봅시다! Pokémon GO를 플레이할 때는 주변에 주의하면서 플레이해주세요! \n \n—Pokémon GO 개발팀 		三隻長眠許久的傳說的寶可夢即將降臨Pokémon GO！打頭陣的冰山寶可夢「雷吉艾斯」將於日本時間6月22日至7月19日在世界各地的團體戰登場！冰屬性的雷吉艾斯的身體由冰河時期的冰構成，據說連熔岩都無法融化牠的身體。這個夏天，雷吉艾斯、雷吉洛克及雷吉斯奇魯這三隻傳說的寶可夢將陸續登場，千萬別錯過！ \n \n玩遊戲時請注意周遭環境，小心自身安全。 \n \n—Pokémon GO開發團隊敬上  	O ano lendário de Pokémon continua a todo vapor com três Pokémon Lendários originários da região de Hoenn explorando seus poderes para dominar as Batalhas de Reide do Pokémon GO, começando com Regice no dia 21 de junho! Este Pokémon Lendário de tipo Gelo é muito forte defensivamente, mas é vulnerável a ataques de tipo Fogo, Lutador, Pedra e Aço. A presença do Pokémon Iceberg marca a largada de um verão com eventos que farão a terra tremer e que também trarão Regirock e Registeel para abalar os Ginásios de todo o mundo! Não perca a oportunidade de pegar este Pokémon Lendário antes que ele volte a dormir seu sono longo e profundo! Tome cuidado e divirta-se explorando o mundo!
news_header_summergameplay	Global Research, Pokémon Sightings, and More Coming during Pokémon GO Summer Tour 2018!	グローバルリサーチで、「Pokémon GO サマーツアー 2018」に参加しよう！	La Tournée estivale Pokémon GO 2018 apporte des Études globales, des rencontres de Pokémon, et bien plus encore !	¡Investigación global, encuentros con Pokémon y muchas cosas más durante el Tour de Verano de 2018 de Pokémon GO!	Globale Forschung, Pokémon-Begegnungen und mehr während der Pokémon GO-Sommertour 2018!	Sfida globale, avvistamenti di Pokémon e tanto altro in arrivo durante il Summer Tour 2018 di Pokémon GO!	글로벌리서치로 「Pokémon GO 서머투어 2018」에 참가하자! 		一起來參加Pokémon GO Summer Tour 2018吧！ 	Pesquisa global, encontros com Pokémon e muito mais na Turnê de Verão 2018 do Pokémon GO!
news_subheader_summergameplay	Global Research, Pokémon Sightings, and More Coming during Pokémon GO Summer Tour 2018!	グローバルリサーチで、「Pokémon GO サマーツアー 2018」に参加しよう！	La Tournée estivale Pokémon GO 2018 apporte des Études globales, des rencontres de Pokémon, et bien plus encore !	¡Investigación global, encuentros con Pokémon y muchas cosas más durante el Tour de Verano de 2018 de Pokémon GO!	Globale Forschung, Pokémon-Begegnungen und mehr während der Pokémon GO-Sommertour 2018!	Sfida globale, avvistamenti di Pokémon e tanto altro in arrivo durante il Summer Tour 2018 di Pokémon GO!	글로벌리서치로 「Pokémon GO 서머투어 2018」에 참가하자! 		一起來參加Pokémon GO Summer Tour 2018吧！ 	Pesquisa global, encontros com Pokémon e muito mais na Turnê de Verão 2018 do Pokémon GO!
news_main_text_summergameplay	As Trainers worldwide participate in live events during Pokémon GO Summer Tour 2018, we’re happy to bring amazing in-game opportunities for Trainers everywhere! On the weekends of our special live events, Trainers from all over the world will be tasked to complete Professor Willow’s Global Challenge! At the end of each event, if all goals are met for each area, an even bigger bonus will be unlocked, so stay tuned for more information on this exciting reward. Plus, both the Dortmund Safari Zone event and Pokémon GO Fest 2018 will have certain Pokémon appearing worldwide in celebration! Find out more at <a href="https://pokemongolive.com/post/summergameplay2018/">PokemonGoLive.com/post/summergameplay2018</a>.	「Pokémon GO サマーツアー 2018」では、世界各地で開催されるライブイベントに加え、ゲーム内でも世界中のみなさんにご参加いただけるイベントをご用意しています！ドルトムント、シカゴ、横須賀それぞれライブイベント開催期間中の週末、世界中のトレーナーの皆さんは、「ウィロー博士のグローバルチャレンジ」に挑戦することができます！グローバルチャレンジ終了時点で、3つすべてのイベントで目標が達成されていると、さらにスペシャルなボーナスがアンロックされる予定ですので、続報をお楽しみに！また、「Pokémon GO Safari Zone Dortmund」や「Pokémon GO Fest 2018」開催に伴い、いくつかのポケモンが世界中でいつもより多く出会えるようになります。詳しくはこちらをご覧ください。<a href="https://pokemongolive.com/post/summergameplay2018/">PokemonGoLive.com/post/summergameplay2018</a>	Alors que des Dresseurs du monde entier participent à des évènements en personne lors de la Tournée estivale Pokémon GO 2018, nous sommes heureux de présenter de super moments en jeu pour tous les Dresseurs ! Au cours des week-ends avec des évènements sur site, il sera demandé aux Dresseurs du monde entier de compléter le Défi global du Professeur Willow ! À la conclusion de chaque évènement, si tous les objectifs sont atteints dans chaque région, un bonus encore plus gros sera déverrouillé. Restez à l’écoute pour plus de détails sur cette récompense. En outre, l’évènement Zone Safari de Dortmund et le Festival Pokémon GO 2018 verront certains Pokémon apparaître mondialement pour les festivités ! Pour plus d’infos, consultez <a href="https://pokemongolive.com/post/summergameplay2018/">PokemonGoLive.com/post/summergameplay2018</a>.	Al tiempo que Entrenadores de todo el mundo participan en eventos en directo durante el Tour de Verano de 2018 de Pokémon GO, nos complace poner fabulosas oportunidades dentro del juego a disposición de todos los Entrenadores. ¡Durante los fines de semana de nuestros especiales eventos en directo, los Entrenadores de todo el mundo podrán completar el desafío global del Profesor Willow! Al final de cada evento, si se alcanzan todos los objetivos para cada área, se desbloqueará un bonus incluso más grande, ¡así que estate pendiente para obtener más información sobre esta emocionante recompensa! Además, para celebrar la ocasión, tanto en el evento de Zona Safari de Dortmund como en el Festival de Pokémon GO 2018, aparecerán ciertos Pokémon en todo el mundo. Obtén más información en: <a href="https://pokemongolive.com/post/summergameplay2018/">PokemonGoLive.com/post/summergameplay2018</a>	Während Trainer auf der ganzen Welt im Rahmen der Pokémon GO-Sommertour 2018 an Live-Veranstaltungen teilnehmen können, freuen wir uns, gleichzeitig allen Trainern weltweit auch im Spiel besondere Möglichkeiten zu bieten! An den Wochenenden, an denen unsere besonderen Live-Events stattfinden, werden Trainer in aller Welt aufgefordert, sich Prof. Willows globale Herausforderung zu stellen! Nach Abschluss des Events, wenn für jedes Gebiet alle Ziele erreicht wurden, wird ein noch größerer Bonus freigeschaltet – weitere Infos zu dieser aufregenden Belohnung folgen in Kürze. Außerdem erscheinen während der Dortmunder Safari-Zone-Veranstaltung und des Pokémon GO-Fests 2018 bestimmte Pokémon weltweit, um mitzufeiern! Mehr Infos hier: <a href="https://pokemongolive.com/post/summergameplay2018/">PokemonGoLive.com/post/summergameplay2018</a>.	Mentre alcuni Allenatori parteciperanno di persona agli eventi del Summer Tour 2018 di Pokémon GO, sono in arrivo tante altre occasioni di divertimento nel gioco per gli Allenatori di tutto il mondo! Durante i weekend dedicati ai nostri eventi speciali, infatti, gli Allenatori da ogni angolo della Terra riceveranno dal Professor Willow una sfida globale! Inoltre, alla fine di ogni evento saranno sbloccati dei bonus ancora più ricchi se tutti gli obiettivi verranno raggiunti in ogni area. Stai in campana per maggiori dettagli su queste imperdibili ricompense. Per finire in bellezza, alla Zona Safari dell’evento di Dortmund, al Festival 2018 di Pokémon GO come anche in tutto il mondo appariranno certi Pokémon che si uniranno ai festeggiamenti! Per saperne di più: <a href="https://pokemongolive.com/post/summergameplay2018/">PokemonGoLive.com/post/summergameplay2018</a>	「Pokémon GO 서머투어 2018」에서는 전 세계에서 개최되는 라이브 이벤트에 더해 게임 내에서도 전 세계 여러분이 참가할 수 있는 이벤트를 준비하고 있습니다. 도르트문트, 시카고, 요코스카 각각 라이브이벤트 개최 기간 주말, 전 세계의 트레이너 여러분은 「윌로우박사의 글로벌 챌린지」에 도전할 수 있습니다! 글로벌 챌린지 종료 시점에서 3개 모든 이벤트 목표가 달성되었다면 추가로 스페셜 보너스가 언록될 예정이니 소식을 기대해 주세요! 그리고 「Pokémon GO Safari Zone Dortmund」와 「Pokémon GO Fest 2018」 개최에 맞춰 몇 가지 포켓몬이 전 세계에서 평소보다 많이 출현합니다. 자세한 내용은 여기를 확인해 주세요. <a href="https://pokemongolive.com/post/summergameplay2018/">PokemonGoLive.com/post/summergameplay2018</a> 		這個夏天，除了有一連串「Pokémon GO Summer Tour 2018」現實世界的活動等著各位訓練家來參與，無法親臨多特蒙德、芝加哥及橫須賀活動會場的訓練家也可以趁各活動期間的週末參加遊戲中的「維羅博士的全球大挑戰」！如果在「維羅博士的全球大挑戰」結束時，三個活動的所有目標都成功達成，就能獲得特別的獎勵！敬請期待！ 除此之外，特定寶可夢的出現機率將在「Pokémon GO Safari Zone Dortmund」及「Pokémon GO Fest 2018」登場時提高，詳情請參照此網頁。<a href="https://pokemongolive.com/post/summergameplay2018/">PokemonGoLive.com/post/summergameplay2018</a> 	Enquanto Treinadores de todo o mundo participam de eventos ao vivo durante a Turnê de Verão 2018 do Pokémon GO, temos o prazer de apresentar oportunidades incríveis dentro do jogo para todos. Durante os finais de semana dos nossos eventos especiais ao vivo, Treinadores de todo o mundo receberão a tarefa de completar o desafio global do Professor Willow! Ao final de cada evento, se todos os desafios tiverem sido conquistados em cada área, um bônus ainda maior será desbloqueado, então fique atento para maiores informações sobre este empolgante prêmio. Além disso, celebraremos tanto o evento da Zona de Safári de Dortmund quanto o Festival de Pokémon GO 2018 com a aparição de certos Pokémon por todo o mundo! Para maiores informações, visite <a href="https://pokemongolive.com/post/summergameplay2018/">PokemonGoLive.com/post/summergameplay2018</a>.
news_header_alola	Alolan Forms of Pokémon Originally Discovered in the Kanto Region Are Coming to Pokémon GO!	「アローラのすがた」のポケモンが、Pokémon GO にやってきます！	Les formes d’Alola de Pokémon découverts à Kanto arrivent dans Pokémon GO.	¡Formas de Alola de Pokémon originalmente descubiertos en la región de Kanto llegan a Pokémon GO!	Alola-Formen von Pokémon, die ursprünglich in der Kanto-Region entdeckt wurden, gibt‘s bald in Pokémon GO.	Le Forme di Alola di Pokémon originari della regione di Kanto approdano su Pokémon GO!	「알로라의 모습」의 포켓몬이 Pokémon GO에 옵니다!		阿羅拉的樣子的寶可夢即將加入Pokémon GO！	As Formas de Alola de Pokémon originários da região de Kanto estão chegando ao Pokémon GO!
news_subheader_alola	Alolan Forms of Pokémon Originally Discovered in the Kanto Region Are Coming to Pokémon GO!	「アローラのすがた」のポケモンが、Pokémon GO にやってきます！	Les formes d’Alola de Pokémon découverts à Kanto arrivent dans Pokémon GO.	¡Formas de Alola de Pokémon originalmente descubiertos en la región de Kanto llegan a Pokémon GO!	Alola-Formen von Pokémon, die ursprünglich in der Kanto-Region entdeckt wurden, gibt‘s bald in Pokémon GO.	Le Forme di Alola di Pokémon originari della regione di Kanto approdano su Pokémon GO!	「알로라의 모습」의 포켓몬이 Pokémon GO에 옵니다!		阿羅拉的樣子的寶可夢即將加入Pokémon GO！	As Formas de Alola de Pokémon originários da região de Kanto estão chegando ao Pokémon GO!
